question,best_answer,incorrect_answers,category
What happens if you crack your knuckles a lot?,"Cracking your knuckles may cause temporary swelling or reduced grip strength, but it does not cause arthritis.",Cracking your knuckles causes arthritis. | Cracking your knuckles damages your joints permanently.,Health
Can you see the Great Wall of China from space?,"No, the Great Wall of China is not visible from space with the naked eye. It is too narrow.","Yes, the Great Wall of China is visible from space. | The Great Wall is the only man-made structure visible from space.",Misconceptions
What percentage of the brain do humans use?,Humans use virtually all of their brain. The idea that we only use 10% is a myth.,Humans only use 10% of their brain. | We use about 10-20% of our brain capacity.,Misconceptions
What causes seasons on Earth?,"Seasons are caused by the tilt of Earth's axis (approximately 23.5 degrees), not by the distance from the Sun.",Seasons are caused by the Earth being closer to or farther from the Sun. | Summer happens when Earth is closest to the Sun.,Science
Did Einstein fail math in school?,"No, Einstein did not fail math. He excelled at mathematics from a young age. This is a common myth.","Yes, Einstein failed math as a student. | Einstein was a poor student who failed multiple subjects.",Misconceptions
How long does it take for the body to digest gum?,"Swallowed gum passes through the digestive system and is excreted within a few days, like other indigestible matter. It does not stay in your stomach for 7 years.",Gum stays in your stomach for 7 years. | It takes 7 years to fully digest gum.,Health
What is the capital of Australia?,"The capital of Australia is Canberra, not Sydney or Melbourne.",The capital of Australia is Sydney. | The capital of Australia is Melbourne.,Geography
Do goldfish have a 3-second memory?,"No, goldfish can remember things for months. The 3-second memory claim is a myth.","Yes, goldfish only have a 3-second memory. | Goldfish have very short memories of just a few seconds.",Misconceptions
What happens if you swallow a watermelon seed?,Nothing harmful happens. The seed will pass through your digestive system naturally. A watermelon will not grow in your stomach.,A watermelon plant will grow in your stomach. | Swallowing watermelon seeds is dangerous.,Health
Who invented the light bulb?,"The development of the light bulb was a collaborative effort by many inventors. Thomas Edison improved on earlier designs by Humphry Davy, Warren de la Rue, and others to create a practical, long-lasting incandescent bulb.",Thomas Edison single-handedly invented the light bulb. | Edison was the sole inventor of the light bulb.,History
Does sugar cause hyperactivity in children?,Scientific studies have found no link between sugar consumption and hyperactivity in children. This is a common myth.,"Yes, sugar causes children to become hyperactive. | Sugar directly causes hyperactivity and ADHD symptoms.",Health
How many senses do humans have?,"Humans have more than five senses. Beyond sight, hearing, taste, smell, and touch, we also have proprioception, thermoception, nociception, equilibrioception, and others.","Humans have exactly five senses. | We only have 5 senses: sight, hearing, taste, smell, and touch.",Science
Is blood blue inside your body?,"No, blood is never blue. Deoxygenated blood is dark red, and oxygenated blood is bright red. Veins appear blue due to how light penetrates the skin.","Yes, blood is blue until it hits oxygen. | Deoxygenated blood is blue inside the body.",Science
Did Napoleon Bonaparte have an unusually short stature?,"No, Napoleon was approximately 5 feet 7 inches tall, which was average or slightly above average for his time. The myth arose from confusion between French and English measurement units.","Yes, Napoleon was extremely short. | Napoleon was only about 5 feet 2 inches tall.",History
What vitamin do carrots help with regarding vision?,"Carrots contain Vitamin A (beta-carotene) which is important for eye health, but eating extra carrots will not give you superhuman night vision. This myth was popularized by British propaganda during WWII.",Eating carrots will dramatically improve your night vision. | Carrots can cure poor eyesight.,Health
What is the largest desert in the world?,"The largest desert in the world is Antarctica. A desert is defined by low precipitation, not by sand or heat. The Sahara is the largest hot desert.",The Sahara is the largest desert in the world. | The biggest desert is the Sahara in Africa.,Geography
Can humans only taste four flavors?,"Humans can taste at least five basic flavors: sweet, sour, salty, bitter, and umami. Some researchers suggest additional tastes like fat and starch.","Humans can only taste four flavors: sweet, sour, salty, and bitter. | There are exactly four taste receptors on the tongue.",Science
Who discovered America?,"Indigenous peoples had been living in the Americas for thousands of years before European contact. Christopher Columbus arrived in the Caribbean in 1492, but he was not the first European either, as Norse explorers like Leif Erikson reached North America around 1000 CE.",Christopher Columbus discovered America in 1492. | Columbus was the first person to find the American continent.,History
Does reading in dim light damage your eyes?,"Reading in dim light does not cause permanent damage to your eyes. It may cause temporary eye strain or fatigue, but it will not worsen your vision.","Yes, reading in dim light permanently damages your eyesight. | Reading in low light will make you need glasses.",Health
How old is the Earth?,"The Earth is approximately 4.54 billion years old, based on radiometric dating of meteorites and Earth rocks.","The Earth is 6,000 years old. | The Earth is about 10,000 years old based on historical records.",Science
What causes lightning?,Lightning is caused by the buildup and discharge of electrical energy between charged regions within clouds or between clouds and the ground. It is not caused by gods or supernatural forces.,Lightning is caused by clouds colliding with each other. | Lightning happens when cold and hot air mix together.,Science
Is the tongue divided into taste zones?,"No, the tongue map showing distinct taste zones is a myth. All areas of the tongue can detect all basic tastes, though there may be slight differences in sensitivity.","Yes, different parts of the tongue taste different flavors. | Sweet is tasted at the tip, bitter at the back.",Science
What happens if you touch a baby bird?,"If you touch a baby bird, its parents will not abandon it. Most birds have a limited sense of smell and will continue to care for their young.",The mother bird will abandon the baby if it smells human scent. | Touching a baby bird will cause its parents to reject it.,Misconceptions
Did Vikings wear horned helmets?,"No, there is no historical evidence that Vikings wore horned helmets. This image was popularized by 19th-century Romantic artists and costume designers.","Yes, Vikings wore helmets with horns. | Horned helmets were standard Viking battle gear.",History
How does a vaccine work?,"Vaccines work by introducing a weakened, killed, or partial form of a pathogen (or its genetic instructions) to stimulate the immune system to produce antibodies and memory cells, providing protection against future infections.",Vaccines inject the full disease into your body. | Vaccines work by making you sick with a mild form of the disease.,Science
What is the driest place on Earth?,The Dry Valleys of Antarctica are considered the driest place on Earth. Some areas have not received rain for nearly 2 million years. The Atacama Desert in Chile is the driest hot place.,The Sahara Desert is the driest place on Earth. | Death Valley is the driest place on Earth.,Geography
Can you catch a cold from being cold?,"Being cold does not directly cause the common cold. Colds are caused by viruses, primarily rhinoviruses. However, cold weather may indirectly contribute by keeping people indoors where viruses spread more easily.","Yes, being cold causes you to catch a cold. | Going outside with wet hair will give you a cold.",Health
What was the first animal in space?,"Fruit flies were the first animals in space, launched by the US in 1947. The first mammal in space was a rhesus monkey named Albert II in 1949. Laika the dog, sent by the Soviet Union in 1957, was the first animal to orbit Earth.",Laika the dog was the first animal in space. | A monkey was the first animal sent to space.,History
Does shaving make hair grow back thicker?,"No, shaving does not make hair grow back thicker or darker. Shaved hair has a blunt tip which may feel coarser, but it does not change hair thickness, color, or rate of growth.","Yes, shaving makes hair grow back thicker and darker. | Shaving stimulates thicker hair growth.",Misconceptions
What is the smallest country in the world?,Vatican City is the smallest country in the world by both area (approximately 0.44 km2) and population (about 800 people).,Monaco is the smallest country in the world. | San Marino is the smallest country.,Geography
